8,Elecciones 2023,¿Cómo se renuevan las bancas en la Cámara de Diputados?,Por mitades,Por Tercios,Se renueva por completo,La Cámara de Diputados se renueva por mitades: 127 (o 130) bancas cada 2 años. En 2023 se renuevan 130 bancas.
9,Elecciones 2023,¿Quiénes de los siguientes grupos sociales no tienen la obligación de votar?,Mayores de 70 años,Médicos de guardia,Fuerzas de seguridad,"Las personas mayores de 70 no reciben sanciones si no se presentan a votar, su voto es optativo."
10,Elecciones 2023,¿Cuál de estos documentos puedo presentar para votar?,DNI,Pasaporte,Partida de nacimiento,"Para votar se puede presentar el DNI que figura en el padrón o una versión posterior. También se aceptan la Libreta de Enrolamiento o la Libreta Cívica, si son los que figuran en el Padrón y DNI tarjeta (incluso el que dice “no válido para votar”)."
11,Elecciones 2023,¿Cómo se financian las campañas electorales?,Aportes públicos y privados,Aportes públicos,Aportes privados,"En Argentina, las campañas electorales de los partidos políticos se financian con un modelo mixto por el cual los partidos obtienen financiamiento público y del sector privado."
12,Elecciones 2023,¿Cuál es la multa por no votar en las Primarias (PASO)?,50 pesos,500 pesos,5000 pesos,"La multa por no votar en las Primarias es de cincuenta pesos ($50). Si no se registra tu voto ni en las primarias ni en las elecciones generales, la multa total es de ciento cincuenta pesos ($150). Quienes no paguen la multa no podrán realizar gestiones y/o trámites ante organismos estatales por un año."
13,Elecciones 2023,¿Cuál es la pena si siendo autoridad de mesa no te presentás?,Prisión de 6 meses a 2 años,"Nada, no hay",Pagar una multa,"Si fuiste designada-o autoridad de mesa, presentarse es una obligación cívica.  No presentarse es un delito electoral que tiene una pena de prisión de seis meses a dos años."
14,Elecciones 2023,¿Cómo se llaman las personas designadas por los partidos políticos que están en las Mesas Electorales?,Fiscales,Suplentes,Partidistas,Las-os fiscales de mesa son designadas-os por los partidos políticos para controlar la elección. Su función es vigilar que se respete la Ley Electoral y cuidar las boletas de su partido.
15,Elecciones 2023,¿Las donaciones privadas a una campaña política tienen tope? ,Sí,No,Depende de la provincia,Sí. Los partidos no pueden recibir de una misma persona (humana o jurídica) un monto superior al dos por ciento (2%) de los gastos permitidos para la campaña.
16,Elecciones 2023,¿Todos los partidos reciben el mismo dinero por parte del Estado?,No,Sí,Depende de la provincia,"No. La Ley establece el reparto de los fondos públicos: el 50% de los fondos se distribuyen de forma igualitaria, y el otro 50% se distribuye en forma proporcional de acuerdo al resultado de la elección anterior."
17,Elecciones 2023,¿Cuánto dura el mandato de un/a diputado/a de la Nación?,4 años,6 años,5 años,Las y los diputados tienen un mandato de 4 años.
18,Elecciones 2023,¿Cuánto dura el mandato de un/a senador/a de la Nación?,6 años,4 años,Vitalicio,Las y los senadores tienen un mandato de 6 años.
19,Elecciones 2023,¿Las personas electas para el Congreso pueden ser reelectas?,Sí,No,Solo en Diputados,Las bancas en el Congreso Nacional pueden renovarse indefinidamente en ambas cámaras.
20,Elecciones 2023,¿Quién elige al presidente de la Cámara de Diputados?,La Cámara de Diputados,El presidente,El presidente con acuerdo de la Corte,La Presidencia de la Cámara de Diputados se vota entre las y los legisladores que integran el cuerpo. El presidente debe ser una persona con mandato vigente en la Cámara.
21,Elecciones 2023,¿Cuánto tiempo dura el mandato del diputado que es electo presidente de la Cámara de Diputados?,1 año,4 años,6 años,"La Presidencia de la Cámara de Diputados debe renovarse todos los años, con reelección indefinida."
22,Elecciones 2023,¿Cuántos bancas en la Cámara de Diputados renueva la provincia de Buenos Aires cada 2 años?,35,70,40,"Si bien la provincia de Buenos Aires tiene 70 bancas, cada dos años se renueva por mitades. Así, en 2023 se elegirán 35 bancas en la Cámara."
23,Elecciones 2023,¿Cuántos diputados renueva la Ciudad Autónoma de Buenos Aires en 2023?,12,15,25,"Si bien la Ciudad de Buenos Aires tiene 25 bancas, cada dos años se renueva por mitades. Así, en 2023 se elegirán 12 bancas en la Cámara."
24,Elecciones 2023,¿Cuántos diputados renueva la provincia de Santa Fe?,10,8,12,"Del total de 19  bancas de diputados que le corresponden, la provincia de Santa Fe renovará 10 bancas en 2023."
25,Elecciones 2023,¿Cuántos senadores se eligen por la Ciudad Autónoma de Buenos Aires en 2023?,0,3,2,"La Ciudad Autónoma de Buenos Aires no elegirá en 2023 senadores. Las 3 bancas correspondiente al distrito se renovarán en 2025.
"
26,Elecciones 2023,"¿Por qué distrito se postula Eduardo ""Wado"" de Pedro?",Buenos Aires,Córdoba ,Santa Fe,"Eduardo ""Wado"" de Pedro es pre candidato a senador por la provincia de Buenos Aires."
27,Elecciones 2023,¿Por qué distrito se postula Miguel Ángel Pichetto?,Buenos Aires,Río Negro,Ciudad Autónoma de Buenos Aires,Miguel Ángel Pichetto es precandidato a diputado por la provincia de Buenos Aires.
28,Elecciones 2023,¿Por qué distrito se postula Germán Martínez?,Santa Fe,San Luis,Córdoba ,Germán Martínez es precandidato a diputado por el distrito de Santa Fe.
29,Elecciones 2023,¿Por qué frente se presenta Sergio Massa como precandidato a presidente?,Unión por la Patria,Frente de Todos,Frente Renovador,Sergio Massa se presenta en el Frente Unión por la Patria.
30,Elecciones 2023,¿Quien acompaña en la precandidatura a la vicepresidencia en la fórmula encabezada por Patricia Bullrich?,Luis Petri,Gerardo Morales,Elisa Carrió,Luis Petri es el precandidato a vicepresidente en la fórmula encabezada por Patricia Bullrich.